{
  "metadata": {
    "id": "ai-flywheel-simple",
    "title": "AI Flywheel: Simple Four-Node Model",
    "archetype": "growth-and-underinvestment",
    "description": "A simplified representation of the AI Flywheel showing how data feeds into models, which make predictions that generate feedback, creating more data in a continuous reinforcing loop.",
    "learning_objectives": [
      "Understand the basic AI Flywheel reinforcing loop structure",
      "Recognize how each component feeds into the next in sequence",
      "Identify the self-reinforcing nature of AI systems",
      "Explore how feedback loops create competitive advantages"
    ],
    "version": "1.0.0",
    "created_date": "2025-08-24T00:00:00Z",
    "updated_date": "2025-08-24T00:00:00Z",
    "author": "Systems Thinking Education Team",
    "tags": ["ai", "flywheel", "reinforcing-loop", "machine-learning", "feedback"]
  },
  "nodes": [
    {
      "id": "data",
      "label": "Data",
      "position": {"x": 300, "y": 100},
      "type": "stock",
      "description": "Data is used to build and improve machine learning models",
      "examples": ["User behavior data", "Transaction records", "Sensor readings", "Historical patterns"],
      "measurement": "Data volume, data quality, dataset completeness"
    },
    {
      "id": "model",
      "label": "Model",
      "position": {"x": 600, "y": 300},
      "type": "variable",
      "description": "Machine learning model trained on available data to make predictions and recommendations",
      "examples": ["Neural networks", "Decision trees", "Recommendation algorithms", "Classification models"],
      "measurement": "Model accuracy, training completion, model complexity"
    },
    {
      "id": "prediction",
      "label": "Prediction",
      "position": {"x": 300, "y": 500},
      "type": "variable",
      "description": "Models create predictions and recommendations which can be evaluated by users",
      "examples": ["Product recommendations", "Risk assessments", "Content suggestions", "Automated decisions"],
      "measurement": "Prediction accuracy, response time, prediction confidence"
    },
    {
      "id": "feedback",
      "label": "Feedback",
      "position": {"x": 100, "y": 300},
      "type": "variable",
      "description": "User respond to predictions and recommendations (thumbs up, thumbs down) which becomes new training data",
      "examples": ["Click-through rates", "User ratings", "Purchase decisions", "Correction data"],
      "measurement": "Feedback volume, feedback quality, user engagement rates"
    }
  ],
  "edges": [
    {
      "id": "data_to_model",
      "source": "data",
      "target": "model",
      "polarity": "positive",
      "description": "More and better data enables training of more accurate models",
      "strength": "strong"
    },
    {
      "id": "model_to_prediction",
      "source": "model",
      "target": "prediction",
      "polarity": "positive",
      "description": "Better trained models generate more accurate and useful predictions",
      "strength": "strong"
    },
    {
      "id": "prediction_to_feedback",
      "source": "prediction",
      "target": "feedback",
      "polarity": "positive",
      "description": "More accurate predictions generate more user engagement and feedback",
      "strength": "strong"
    },
    {
      "id": "feedback_to_data",
      "source": "feedback",
      "target": "data",
      "polarity": "positive",
      "description": "User feedback becomes new training data to improve the model",
      "strength": "strong",
      "delay": {
        "present": true,
        "duration": "1-4 weeks",
        "description": "Processing and incorporating feedback into training data takes time"
      }
    }
  ],
  "loops": [
    {
      "id": "ai_flywheel_simple_loop",
      "type": "reinforcing",
      "path": ["data", "model", "prediction", "feedback", "data"],
      "label": "AI Flywheel",
      "description": "Data enables better models, which create better predictions, generating more feedback that becomes new data",
      "behavior_pattern": "Continuous improvement and acceleration of AI system performance",
      "position": {"x": 400, "y": 350},
      "is_primary": true
    }
  ],
  "leverage_points": [
    {
      "id": "data_quality",
      "target_type": "node",
      "target_id": "data",
      "leverage_level": 4,
      "title": "Improve Data Quality",
      "description": "Focus on collecting higher quality, more representative data",
      "intervention_strategies": [
        "Implement data validation and cleaning processes",
        "Diversify data sources to reduce bias",
        "Establish data governance standards"
      ],
      "expected_impact": "Better models and predictions throughout the entire flywheel",
      "difficulty": "moderate"
    },
    {
      "id": "feedback_mechanisms",
      "target_type": "edge",
      "target_id": "prediction_to_feedback",
      "leverage_level": 3,
      "title": "Enhance Feedback Collection",
      "description": "Improve systems for capturing and utilizing user feedback",
      "intervention_strategies": [
        "Design better user interfaces for feedback collection",
        "Implement implicit feedback tracking",
        "Create incentives for user participation"
      ],
      "expected_impact": "Increases the volume and quality of feedback data",
      "difficulty": "low"
    }
  ],
  "scenarios": [
    {
      "id": "data_improvement",
      "title": "Improve Initial Data Quality",
      "description": "Organization invests in better data collection and cleaning processes",
      "changes": [
        {
          "target_type": "node",
          "target_id": "data",
          "change_description": "Data quality and representativeness significantly improved"
        }
      ],
      "predicted_outcomes": "Better models leading to more accurate predictions and higher quality feedback"
    },
    {
      "id": "feedback_enhancement",
      "title": "Optimize Feedback Systems",
      "description": "Organization improves mechanisms for collecting and processing user feedback",
      "changes": [
        {
          "target_type": "edge",
          "target_id": "prediction_to_feedback",
          "change_description": "Feedback collection becomes more comprehensive and efficient"
        }
      ],
      "predicted_outcomes": "More feedback data accelerates the entire flywheel cycle"
    }
  ],
  "educational_content": {
    "discussion_questions": [
      "How does each component in the AI Flywheel depend on the previous one?",
      "What happens if one component in the loop performs poorly?",
      "Why is this called a 'flywheel' - what does that mechanical metaphor suggest?",
      "How might delays in the feedback loop affect system performance?",
      "Where would you intervene to most effectively improve the entire system?"
    ],
    "key_insights": [
      "The AI Flywheel is a single reinforcing loop where each component strengthens the next",
      "System performance depends on the weakest link in the four-component chain",
      "Small improvements in any component can amplify throughout the entire system",
      "The flywheel effect means AI systems can become self-improving over time",
      "Delays in feedback processing can slow down the entire improvement cycle"
    ],
    "common_misconceptions": [
      {
        "misconception": "AI models only need to be trained once with good data",
        "correction": "The flywheel shows that continuous feedback and retraining are essential for ongoing improvement"
      },
      {
        "misconception": "Predictions are the end goal of AI systems",
        "correction": "Predictions are just one component - the feedback they generate is crucial for system improvement"
      }
    ],
    "extension_activities": [
      "Identify real-world examples of each component in AI systems you use",
      "Trace the flywheel loop in a specific AI application like Netflix recommendations",
      "Design experiments to improve one component and predict effects on others"
    ],
    "related_concepts": [
      "Reinforcing Loops",
      "Feedback Systems",
      "Machine Learning Pipeline",
      "Continuous Improvement",
      "System Dynamics"
    ]
  }
}